Rank;Sourceid;Title;Type;Issn;SJR;SJR Quartile;H index;Total Docs. (2013);Total Docs. (3years);Total Refs.;Total Cites (3years);Citable Docs. (3years);Cites / Doc. (2years);Ref. / Doc.;Country;Region;Publisher;Coverage;Categories
1;19300156903;"Foundations and Trends in Machine Learning";journal;"19358245, 19358237";10,454;Q1;35;3;10;467;411;10;13,71;155,67;United States;Northern America;"Now Publishers Inc";"2008-2019";"Artificial Intelligence (Q1); Human-Computer Interaction (Q1); Software (Q1)"
2;24254;"IEEE Transactions on Pattern Analysis and Machine Intelligence";journal;"01628828";4,301;Q1;372;226;577;10325;8041;562;12,13;45,69;United States;Northern America;"IEEE Computer Society";"1978-2020";"Applied Mathematics (Q1); Artificial Intelligence (Q1); Computational Theory and Mathematics (Q1); Computer Vision and Pattern Recognition (Q1); Software (Q1)"
3;19700190323;"ACM Transactions on Intelligent Systems and Technology";journal;"21576912, 21576904";3,927;Q1;63;97;135;4027;2299;120;18,83;41,52;United States;Northern America;"Association for Computing Machinery (ACM)";"2010-2020";"Artificial Intelligence (Q1); Theoretical Computer Science (Q1)"
4;12872;"Cognitive Psychology";journal;"10955623, 00100285";3,603;Q1;120;22;68;1620;358;68;3,93;73,64;United States;Northern America;"Academic Press Inc.";"1970-2020";"Artificial Intelligence (Q1); Developmental and Educational Psychology (Q1); Experimental and Cognitive Psychology (Q1); Linguistics and Language (Q1); Neuropsychology and Physiological Psychology (Q1)"
5;24242;"IEEE Transactions on Fuzzy Systems";journal;"10636706";3,368;Q1;191;94;281;4301;2639;279;9,06;45,76;United States;Northern America;"Institute of Electrical and Electronics Engineers Inc.";"1993-2020";"Applied Mathematics (Q1); Artificial Intelligence (Q1); Computational Theory and Mathematics (Q1); Control and Systems Engineering (Q1)"
6;72242;"International Journal of Computer Vision";journal;"09205691, 15731405";3,305;Q1;199;94;293;4126;2421;281;6,77;43,89;Netherlands;Western Europe;"Springer Netherlands";"1987-2020";"Artificial Intelligence (Q1); Computer Vision and Pattern Recognition (Q1); Software (Q1)"
7;23127;"Journal of the ACM";journal;"00045411, 1557735X";2,806;Q1;134;45;92;1967;515;81;5,88;43,71;United States;Northern America;"Association for Computing Machinery (ACM)";"1954-2020";"Artificial Intelligence (Q1); Control and Systems Engineering (Q1); Hardware and Architecture (Q1); Information Systems (Q1); Software (Q1)"
8;18050;"International Journal of Robotics Research";journal;"02783649, 17413176";2,659;Q1;168;93;299;3988;1922;281;6,31;42,88;United States;Northern America;"SAGE Publications Inc.";"1982-2020";"Applied Mathematics (Q1); Artificial Intelligence (Q1); Electrical and Electronic Engineering (Q1); Mechanical Engineering (Q1); Modeling and Simulation (Q1); Software (Q1)"
9;22478;"Journal of Memory and Language";journal;"10960821, 0749596X";2,376;Q1;145;55;200;3497;737;200;3,05;63,58;United States;Northern America;"Academic Press Inc.";"1985-2021";"Artificial Intelligence (Q1); Experimental and Cognitive Psychology (Q1); Language and Linguistics (Q1); Linguistics and Language (Q1); Neuropsychology and Physiological Psychology (Q1)"
10;21100235616;"IEEE Transactions on Neural Networks and Learning Systems";journal;"2162237X, 21622388";2,330;Q1;212;183;565;7253;3686;558;6,29;39,63;United States;Northern America;"IEEE Computational Intelligence Society";"2012-2020";"Artificial Intelligence (Q1); Computer Networks and Communications (Q1); Computer Science Applications (Q1); Software (Q1)"
11;12874;"Cognitive Science";journal;"03640213, 15516709";2,236;Q1;114;62;183;3585;645;181;2,94;57,82;United States;Northern America;"Wiley-Blackwell";"1977-2020";"Artificial Intelligence (Q1); Cognitive Neuroscience (Q1); Experimental and Cognitive Psychology (Q1)"
12;15134;"Information Sciences";journal;"00200255";2,171;Q1;184;611;1133;25733;6588;1121;5,68;42,12;United States;Northern America;"Elsevier Inc.";"1968-2021";"Artificial Intelligence (Q1); Computer Science Applications (Q1); Control and Systems Engineering (Q1); Information Systems and Management (Q1); Software (Q1); Theoretical Computer Science (Q1)"
13;20000195007;"CIDR 2011 - 5th Biennial Conference on Innovative Data Systems Research, Conference Proceedings";conference and proceedings;"-";2,139;-;21;0;40;0;332;39;8,30;0,00;United States;Northern America;"";"2011";"Artificial Intelligence; Hardware and Architecture; Information Systems; Information Systems and Management"
14;19700180515;"ICML 2010 - Proceedings, 27th International Conference on Machine Learning";conference and proceedings;"-";1,665;-;59;0;161;0;982;159;0,00;0,00;United States;Northern America;"";"2010";"Artificial Intelligence; Education"
15;24772;"Knowledge-Based Systems";journal;"09507051";1,563;Q1;121;297;488;12856;2290;481;4,57;43,29;Netherlands;Western Europe;"Elsevier";"1987-2020";"Artificial Intelligence (Q1); Information Systems and Management (Q1); Management Information Systems (Q1); Software (Q1)"
16;18016;"Autonomous Robots";journal;"15737527, 09295593";1,521;Q1;115;41;157;1609;680;150;4,32;39,24;Netherlands;Western Europe;"Springer Netherlands";"1994-2020";"Artificial Intelligence (Q1)"
17;19700177336;"International Journal of Machine Learning and Cybernetics";journal;"1868808X, 18688071";1,432;Q1;44;66;67;2330;392;65;5,76;35,30;United States;Northern America;"Springer Science + Business Media";"2010-2020";"Artificial Intelligence (Q1); Computer Vision and Pattern Recognition (Q1); Software (Q1)"
18;19900191732;"Argument and Computation";journal;"19462166, 19462174";1,430;Q1;20;11;24;496;90;23;1,62;45,09;United Kingdom;Western Europe;"IOS Press";"2010-2020";"Artificial Intelligence (Q1); Computational Mathematics (Q1); Computer Science Applications (Q1); Linguistics and Language (Q1)"
19;21000195309;"2011 10th IEEE International Symposium on Mixed and Augmented Reality, ISMAR 2011";conference and proceedings;"-";1,429;-;18;0;42;0;328;41;7,81;0,00;United States;Northern America;"";"2011";"Artificial Intelligence"
20;24358;"Journal of Heuristics";journal;"13811231, 15729397";1,372;Q1;67;40;105;1177;273;103;2,30;29,43;Netherlands;Western Europe;"Springer Netherlands";"1995-2020";"Artificial Intelligence (Q1); Computer Networks and Communications (Q1); Control and Optimization (Q1); Information Systems (Q1); Management Science and Operations Research (Q1); Software (Q1)"
21;23675;"Artificial Intelligence";journal;"00043702";1,347;Q1;154;72;201;3824;1002;196;4,60;53,11;Netherlands;Western Europe;"Elsevier";"1970-2020";"Artificial Intelligence (Q1); Language and Linguistics (Q1); Linguistics and Language (Q1)"
22;23640;"Advanced Engineering Informatics";journal;"14740346";1,345;Q1;81;54;193;2497;754;177;3,90;46,24;United Kingdom;Western Europe;"Elsevier Ltd.";"2002-2020";"Artificial Intelligence (Q1); Information Systems (Q1)"
23;26529;"Fuzzy Sets and Systems";journal;"01650114";1,342;Q1;169;182;554;5404;1578;541;2,67;29,69;Netherlands;Western Europe;"Elsevier";"1978-2020";"Artificial Intelligence (Q1); Logic (Q1)"
24;24201;"Expert Systems with Applications";journal;"09574174";1,305;Q1;207;729;4084;27873;14912;4074;3,41;38,23;United Kingdom;Western Europe;"Elsevier Ltd.";"1990-2021";"Artificial Intelligence (Q1); Computer Science Applications (Q1); Engineering (miscellaneous) (Q1)"
25;4000148905;"IEEE Computational Intelligence Magazine";journal;"1556603X";1,301;Q1;56;42;116;769;352;82;2,56;18,31;United States;Northern America;"Institute of Electrical and Electronics Engineers Inc.";"2006-2020";"Artificial Intelligence (Q1); Theoretical Computer Science (Q1)"
26;15703;"Knowledge and Information Systems";journal;"02191377, 02193116";1,277;Q1;76;106;284;5178;1050;279;3,56;48,85;United Kingdom;Western Europe;"Springer London";"2005-2020";"Artificial Intelligence (Q1); Hardware and Architecture (Q1); Human-Computer Interaction (Q1); Information Systems (Q1); Software (Q1)"
27;24823;"Pattern Recognition";journal;"00313203";1,262;Q1;210;285;959;11641;4672;952;4,47;40,85;United Kingdom;Western Europe;"Elsevier Ltd.";"1968-2021";"Artificial Intelligence (Q1); Computer Vision and Pattern Recognition (Q1); Signal Processing (Q1); Software (Q1)"
28;19294;"Journal of Scheduling";journal;"10946136";1,244;Q1;61;50;148;1039;269;141;1,88;20,78;United States;Northern America;"Springer New York";"1998-2020";"Artificial Intelligence (Q1); Engineering (miscellaneous) (Q1); Management Science and Operations Research (Q1); Software (Q1)"
29;20969;"Journal of Machine Learning Research";journal;"15337928, 15324435";1,235;Q1;230;278;920;8179;3511;902;2,89;29,42;United States;Northern America;"Microtome Publishing";"2001-2020";"Artificial Intelligence (Q1); Control and Systems Engineering (Q1); Software (Q1); Statistics and Probability (Q2)"
30;36450;"Design Studies";journal;"0142694X";1,221;Q1;92;33;89;1609;319;85;3,66;48,76;United Kingdom;Western Europe;"Elsevier Ltd.";"1979-2020";"Architecture (Q1); Artificial Intelligence (Q1); Arts and Humanities (miscellaneous) (Q1); Computer Science Applications (Q1); Engineering (miscellaneous) (Q1); Social Sciences (miscellaneous) (Q1)"
31;24207;"Fuzzy Optimization and Decision Making";journal;"15732908, 15684539";1,207;Q1;51;28;63;590;167;63;2,26;21,07;United States;Northern America;"Springer New York";"2002-2020";"Artificial Intelligence (Q1); Logic (Q1); Software (Q1)"
32;15631;"International Journal of Information Management";journal;"02684012";1,174;-;114;93;201;5831;963;180;3,94;62,70;United Kingdom;Western Europe;"Elsevier Ltd.";"1970, 1986-2021";"Computer Networks and Communications (Q1); Information Systems (Q1); Library and Information Sciences (Q1)"
33;24775;"Machine Learning";journal;"15730565, 08856125";1,159;Q1;152;61;174;2457;705;161;3,81;40,28;Netherlands;Western Europe;"Springer Netherlands";"1986-2020";"Artificial Intelligence (Q1); Software (Q1)"
34;144945;"Networks and Spatial Economics";journal;"1566113X";1,147;Q1;48;21;94;876;181;90;1,95;41,71;Netherlands;Western Europe;"Kluwer Academic Publishers";"2005-2020";"Artificial Intelligence (Q1); Computer Networks and Communications (Q1); Software (Q1)"
35;24286;"International Journal of Approximate Reasoning";journal;"0888613X, 18734731";1,145;Q1;97;95;254;3357;794;240;3,15;35,34;United States;Northern America;"Elsevier Inc.";"1974, 1987-2020";"Applied Mathematics (Q1); Artificial Intelligence (Q1); Software (Q1); Theoretical Computer Science (Q1)"
36;17700156773;"Synthesis Lectures on Artificial Intelligence and Machine Learning";book series;"19394616, 19394608";1,098;Q1;24;5;13;965;73;12;5,80;193,00;United States;Northern America;"Morgan and Claypool Publishers";"2009-2020";"Artificial Intelligence (Q1)"
37;18197;"Integrated Computer-Aided Engineering";journal;"10692509, 18758835";1,081;Q1;42;29;88;1322;340;81;4,21;45,59;Netherlands;Western Europe;"IOS Press";"1993-2020";"Artificial Intelligence (Q1); Computational Theory and Mathematics (Q1); Computer Science Applications (Q1); Software (Q1); Theoretical Computer Science (Q1)"
38;26803;"Journal of Pragmatics";journal;"03782166";1,079;Q1;93;162;625;7948;898;590;1,31;49,06;Netherlands;Western Europe;"Elsevier";"1977-2020";"Artificial Intelligence (Q1); Language and Linguistics (Q1); Linguistics and Language (Q1)"
39;19900191735;"Topics in Cognitive Science";journal;"17568765, 17568757";1,041;Q1;56;45;176;1878;410;152;1,90;41,73;United States;Northern America;"Wiley-Blackwell";"2009-2020";"Artificial Intelligence (Q1); Human-Computer Interaction (Q1); Linguistics and Language (Q1); Cognitive Neuroscience (Q2); Experimental and Cognitive Psychology (Q2)"
40;21100285028;"IEEE Transactions on Human-Machine Systems";journal;"21682291";1,034;Q1;123;56;299;2424;1446;293;3,79;43,29;United States;Northern America;"IEEE Systems, Man, and Cybernetics Society";"2013-2020";"Artificial Intelligence (Q1); Computer Networks and Communications (Q1); Computer Science Applications (Q1); Control and Systems Engineering (Q1); Human-Computer Interaction (Q1); Human Factors and Ergonomics (Q1); Signal Processing (Q1)"
41;145544;"Journal of Semantics";journal;"01675133, 14774593";1,031;Q1;39;25;43;1182;49;42;1,06;47,28;United Kingdom;Western Europe;"Oxford University Press";"1982-1986, 1990-2019";"Artificial Intelligence (Q1); Arts and Humanities (miscellaneous) (Q1); Linguistics and Language (Q1)"
42;24305;"International Journal of Intelligent Systems";journal;"1098111X, 08848173";1,024;Q1;87;65;176;1845;516;169;2,15;28,38;United Kingdom;Western Europe;"John Wiley and Sons Ltd";"1986-2020";"Artificial Intelligence (Q1); Human-Computer Interaction (Q1); Software (Q1); Theoretical Computer Science (Q1)"
43;24182;"Engineering Applications of Artificial Intelligence";journal;"09521976";0,996;Q2;104;233;428;8962;1507;421;3,32;38,46;United Kingdom;Western Europe;"Elsevier Ltd.";"1988-2020";"Control and Systems Engineering (Q1); Electrical and Electronic Engineering (Q1); Artificial Intelligence (Q2)"
44;13880;"Artificial Intelligence and Law";journal;"09248463, 15728382";0,989;Q2;37;17;43;767;87;43;1,60;45,12;Netherlands;Western Europe;"Springer Netherlands";"1992-1993, 1995-2020";"Law (Q1); Artificial Intelligence (Q2)"
45;13017;"Physics of Life Reviews";journal;"18731457, 15710645";0,977;Q2;65;104;236;2763;359;35;1,47;26,57;Netherlands;Western Europe;"Elsevier";"2004-2020";"Agricultural and Biological Sciences (miscellaneous) (Q1); Physics and Astronomy (miscellaneous) (Q1); Artificial Intelligence (Q2)"
46;24363;"Journal of Intelligent Manufacturing";journal;"15728145, 09565515";0,952;Q2;79;98;368;3452;716;354;1,87;35,22;Netherlands;Western Europe;"Springer Netherlands";"1990-2020";"Industrial and Manufacturing Engineering (Q1); Software (Q1); Artificial Intelligence (Q2)"
47;21100199837;"Frontiers in Neurorobotics";journal;"16625218";0,900;Q2;34;24;29;1148;88;28;4,06;47,83;Switzerland;Western Europe;"Frontiers Media S.A.";"2007-2020";"Artificial Intelligence (Q2); Biomedical Engineering (Q2)"
48;23674;"Applied Intelligence";journal;"0924669X, 15737497";0,865;Q2;66;92;214;3564;610;211;2,96;38,74;Netherlands;Western Europe;"Springer Netherlands";"1991-2020";"Artificial Intelligence (Q2)"
49;24157;"Autonomous Agents and Multi-Agent Systems";journal;"15737454, 13872532";0,846;Q2;72;31;103;1346;330;95;3,03;43,42;Netherlands;Western Europe;"Springer Netherlands";"1998-2020";"Artificial Intelligence (Q2)"
50;19900191948;"2011 IEEE International Conference on Automatic Face and Gesture Recognition and Workshops, FG 2011";conference and proceedings;"-";0,843;-;35;0;152;0;559;151;3,68;0,00;United States;Northern America;"";"2011";"Artificial Intelligence; Computer Vision and Pattern Recognition"
51;24330;"Journal of Artificial Intelligence Research";journal;"10769757";0,841;Q2;123;60;160;3497;689;160;2,98;58,28;United States;Northern America;"Morgan Kaufmann Publishers, Inc.";"1993, 1996-2020";"Artificial Intelligence (Q2)"
52;24804;"Neural Networks";journal;"08936080, 18792782";0,824;Q2;148;168;412;8259;1433;396;3,15;49,16;United Kingdom;Western Europe;"Elsevier Ltd.";"1988-2020";"Artificial Intelligence (Q2); Cognitive Neuroscience (Q3)"
53;28424;"Theory and Practice of Logic Programming";journal;"14753081, 14710684";0,819;Q2;47;44;117;1265;278;113;2,50;28,75;United Kingdom;Western Europe;"Cambridge University Press";"2001-2020";"Hardware and Architecture (Q1); Software (Q1); Artificial Intelligence (Q2); Computational Theory and Mathematics (Q2); Theoretical Computer Science (Q2)"
54;24807;"Neurocomputing";journal;"09252312";0,817;Q2;143;702;1139;24274;3560;1107;2,96;34,58;Netherlands;Western Europe;"Elsevier";"1989-2020";"Artificial Intelligence (Q2); Computer Science Applications (Q2); Cognitive Neuroscience (Q3)"
55;24141;"Artificial Intelligence Review";journal;"02692821, 15737462";0,816;Q2;78;42;108;1910;435;108;2,41;45,48;Netherlands;Western Europe;"Springer Netherlands";"1986-2020";"Language and Linguistics (Q1); Linguistics and Language (Q1); Artificial Intelligence (Q2)"
56;12409;"Multidimensional Systems and Signal Processing";journal;"15730824, 09236082";0,810;Q2;39;38;71;935;127;67;1,83;24,61;Netherlands;Western Europe;"Springer Netherlands";"1990-2020";"Hardware and Architecture (Q1); Information Systems (Q1); Signal Processing (Q1); Software (Q1); Applied Mathematics (Q2); Artificial Intelligence (Q2); Computer Science Applications (Q2)"
57;23678;"Artificial Intelligence for Engineering Design, Analysis and Manufacturing: AIEDAM";journal;"08900604, 14691760";0,768;Q2;53;33;100;1367;140;83;0,98;41,42;United Kingdom;Western Europe;"Cambridge University Press";"1987-2020";"Industrial and Manufacturing Engineering (Q1); Artificial Intelligence (Q2)"
58;24825;"Pattern Recognition Letters";journal;"01678655";0,768;Q2;157;259;819;8125;2566;799;2,61;31,37;Netherlands;Western Europe;"Elsevier";"1982-2020";"Software (Q1); Artificial Intelligence (Q2); Computer Vision and Pattern Recognition (Q2); Signal Processing (Q2)"
59;110111;"IEEE Intelligent Systems";journal;"15411672";0,762;Q2;124;80;224;1048;635;201;2,78;13,10;United States;Northern America;"Institute of Electrical and Electronics Engineers Inc.";"2001-2020";"Computer Networks and Communications (Q1); Artificial Intelligence (Q2)"
60;21100224431;"2012 2nd International Conference on Applied Robotics for the Power Industry, CARPI 2012";conference and proceedings;"-";0,761;-;1;0;1;0;1;1;1,00;0,00;United States;Northern America;"";"";"Artificial Intelligence; Energy Engineering and Power Technology; Human-Computer Interaction"
61;21100223801;"10th Int. Conference on Bioinformatics - 1st ISCB Asia Joint Conference 2011, InCoB 2011/ISCB-Asia 2011: Computational Biology - Proceedings from Asia Pacific Bioinformatics Network (APBioNet)";conference and proceedings;"-";0,760;-;10;0;27;0;43;26;1,59;0,00;United Kingdom;Western Europe;"";"2011";"Agricultural and Biological Sciences (miscellaneous); Artificial Intelligence; Biotechnology; Computational Theory and Mathematics; Computer Science Applications; Genetics; Software"
62;24175;"Constraints";journal;"15729354, 13837133";0,753;Q2;46;20;57;904;150;54;2,97;45,20;Netherlands;Western Europe;"Springer Netherlands";"1996-2020";"Artificial Intelligence (Q2); Computational Theory and Mathematics (Q2); Discrete Mathematics and Combinatorics (Q2); Software (Q2)"
63;24306;"Digital Signal Processing: A Review Journal";journal;"10954333, 10512004";0,749;-;76;196;363;5583;1034;355;2,16;28,48;United States;Northern America;"Elsevier Inc.";"1991-2020";"Electrical and Electronic Engineering (Q1); Signal Processing (Q2)"
64;21100784665;"IEEE Transactions on Cognitive and Developmental Systems";journal;"23798920, 23798939";0,746;Q2;41;26;75;1395;222;67;2,33;53,65;United States;Northern America;"Institute of Electrical and Electronics Engineers Inc.";"2016-2020";"Artificial Intelligence (Q2); Software (Q2)"
65;19700177025;"IEEE Transactions on Computational Intelligence and AI in Games";journal;"1943068X, 19430698";0,746;Q2;0;0;0;0;0;0;0,00;0,00;United States;Northern America;"Institute of Electrical and Electronics Engineers Inc.";"2009-2018";"Electrical and Electronic Engineering (Q1); Artificial Intelligence (Q2); Control and Systems Engineering (Q2); Software (Q2)"
66;12795;"Perception";journal;"14684233, 03010066";0,732;Q2;91;127;460;3499;564;424;1,01;27,55;United States;Northern America;"SAGE Publications Inc.";"1972-2020";"Artificial Intelligence (Q2); Ophthalmology (Q2); Experimental and Cognitive Psychology (Q3); Sensory Systems (Q3)"
67;24774;"Knowledge Engineering Review";journal;"14698005, 02698889";0,724;Q2;62;32;67;2331;179;64;2,80;72,84;United Kingdom;Western Europe;"Cambridge University Press";"1984, 1987-2020";"Artificial Intelligence (Q2); Software (Q2)"
68;99254;"Proceedings of the International Conference on Artificial Intelligence and Law";conference and proceedings;"-";0,714;-;32;42;37;705;48;35;1,30;16,79;United States;Northern America;"";"1989, 1995, 2001, 2003, 2005, 2007, 2009, 2011, 2013";"Artificial Intelligence; Law; Software"
69;25456;"Proceedings - IEEE International Conference on Robotics and Automation";conference and proceedings;"10504729";0,710;-;187;874;2733;17902;7024;2727;2,58;20,48;United States;Northern America;"Institute of Electrical and Electronics Engineers Inc.";"1984-1985, 1991-2019";"Artificial Intelligence; Control and Systems Engineering; Electrical and Electronic Engineering; Software"
70;19400157504;"IJCAI International Joint Conference on Artificial Intelligence";conference and proceedings;"10450823";0,698;-;140;491;484;10418;1293;482;2,67;21,22;United States;Northern America;"";"1997, 1999, 2001, 2003, 2005, 2007, 2009, 2011, 2013, 2015, 2019";"Artificial Intelligence"
71;24140;"Artificial Intelligence in Medicine";journal;"09333657, 18732860";0,697;Q2;87;61;166;2487;478;157;2,55;40,77;Netherlands;Western Europe;"Elsevier";"1989-2020";"Artificial Intelligence (Q2); Medicine (miscellaneous) (Q2)"
72;19900194906;"Proceedings of the 27th Conference on Uncertainty in Artificial Intelligence, UAI 2011";conference and proceedings;"-";0,695;-;23;0;100;0;226;99;2,26;0,00;United States;Northern America;"";"2011";"Applied Mathematics; Artificial Intelligence"
73;21100210905;"i-Perception";journal;"20416695";0,691;Q2;26;45;113;1371;173;102;1,48;30,47;United Kingdom;Western Europe;"SAGE Publications Ltd";"2010-2020";"Artificial Intelligence (Q2); Ophthalmology (Q2); Experimental and Cognitive Psychology (Q3); Sensory Systems (Q4)"
74;23737;"Computational Intelligence";journal;"08247935, 14678640";0,674;Q2;52;26;85;1198;165;71;1,64;46,08;United Kingdom;Western Europe;"Wiley-Blackwell Publishing Ltd";"1985-2020";"Artificial Intelligence (Q2); Computational Mathematics (Q2)"
75;19700186852;"Journal of Multimedia (discontinued)";journal;"17962048";0,674;Q2;25;111;191;2270;461;180;3,17;20,45;Finland;Western Europe;"Academy Publisher";"2006-2013";"Electrical and Electronic Engineering (Q1); Media Technology (Q1); Artificial Intelligence (Q2)"
76;130113;"Cognitive Processing";journal;"16124782, 16124790";0,670;Q2;44;47;178;1909;377;174;1,82;40,62;Germany;Western Europe;"Springer Verlag";"2005-2020";"Artificial Intelligence (Q2); Medicine (miscellaneous) (Q2); Cognitive Neuroscience (Q3); Experimental and Cognitive Psychology (Q3)"
77;24354;"Journal of Automated Reasoning";journal;"15730670, 01687433";0,660;Q2;56;37;103;943;154;94;1,54;25,49;Netherlands;Western Europe;"Springer Netherlands";"1985-2020";"Artificial Intelligence (Q2); Software (Q2); Computational Theory and Mathematics (Q3)"
78;26801;"Computational Linguistics";journal;"08912017, 15309312";0,655;Q2;98;32;84;1961;405;82;5,28;61,28;United States;Northern America;"MIT Press Journals";"1985, 1996-2020";"Language and Linguistics (Q1); Linguistics and Language (Q1); Artificial Intelligence (Q2); Computer Science Applications (Q2)"
79;26138;"Parallel Computing";journal;"01678191";0,653;Q2;68;58;149;1909;452;139;3,20;32,91;Netherlands;Western Europe;"Elsevier";"1984-2020";"Computer Graphics and Computer-Aided Design (Q1); Computer Networks and Communications (Q1); Hardware and Architecture (Q1); Artificial Intelligence (Q2); Software (Q2); Theoretical Computer Science (Q2)"
80;19900194913;"Proceedings of the 26th Conference on Uncertainty in Artificial Intelligence, UAI 2010";conference and proceedings;"-";0,633;-;23;0;89;0;228;88;0,00;0,00;United States;Northern America;"";"2010";"Applied Mathematics; Artificial Intelligence"
81;23617;"AI Communications";journal;"09217126";0,618;Q2;40;35;78;856;165;74;2,18;24,46;Netherlands;Western Europe;"IOS Press";"1987-2020";"Artificial Intelligence (Q2)"
82;21100301601;"ACM Transactions on Interactive Intelligent Systems";journal;"21606463, 21606455";0,596;Q2;34;20;37;849;123;34;3,32;42,45;United States;Northern America;"Association for Computing Machinery (ACM)";"2011-2020";"Artificial Intelligence (Q2); Human-Computer Interaction (Q2)"
83;19900191975;"Journal of Uncertain Systems";journal;"17528917, 17528909";0,576;Q2;18;34;67;646;109;65;1,63;19,00;United Kingdom;Western Europe;"World Academic Union";"2011-2019";"Artificial Intelligence (Q2); Computer Vision and Pattern Recognition (Q2); Control and Optimization (Q3)"
84;12358;"International Journal of Fuzzy Systems";journal;"15622479, 21993211";0,566;Q2;42;49;138;1451;249;134;1,65;29,61;Switzerland;Western Europe;"Springer International Publishing AG";"2004-2020";"Artificial Intelligence (Q2); Software (Q2); Theoretical Computer Science (Q2); Computational Theory and Mathematics (Q3)"
85;21100199738;"2011 IEEE Workshop on Automatic Speech Recognition and Understanding, ASRU 2011, Proceedings";conference and proceedings;"-";0,564;-;16;0;98;0;270;97;2,76;0,00;United States;Northern America;"";"2011";"Artificial Intelligence; Computer Vision and Pattern Recognition; Human-Computer Interaction"
86;19600166036;"International Journal of Artificial Intelligence";journal;"09740635";0,562;Q2;26;27;94;615;199;87;2,16;22,78;India;Asiatic Region;"Indian Society for Development and Environment Research";"2009-2020";"Artificial Intelligence (Q2)"
87;21100310020;"Proceedings of the International Joint Conference on Autonomous Agents and Multiagent Systems, AAMAS";conference and proceedings;"15488403, 15582914";0,560;-;53;0;165;0;467;162;0,00;0,00;United States;Northern America;"";"2008, 2009, 2010, 2015, 2019";"Artificial Intelligence; Control and Systems Engineering; Software"
88;11700154734;"Swarm Intelligence";journal;"19353820, 19353812";0,555;Q2;39;14;40;757;116;38;3,23;54,07;United States;Northern America;"Springer New York";"2008-2020";"Artificial Intelligence (Q2)"
89;21100449022;"9th Meeting on Analytic Algorithmics and Combinatorics 2012, ANALCO 2012";conference and proceedings;"-";0,554;-;3;0;9;0;1;7;0,11;0,00;United States;Northern America;"";"2012";"Artificial Intelligence"
