Rank;Sourceid;Title;Type;Issn;SJR;SJR Quartile;H index;Total Docs. (2013);Total Docs. (3years);Total Refs.;Total Cites (3years);Citable Docs. (3years);Cites / Doc. (2years);Ref. / Doc.;Country;Region;Publisher;Coverage;Categories
679;21100236806;"11th IEEE International Symposium on Mixed and Augmented Reality 2012 - Arts, Media, and Humanities Papers, ISMAR-AMH 2012";conference and proceedings;"-";0,103;-;8;0;24;0;19;19;0,79;0,00;United States;Northern America;"";"2012";"Artificial Intelligence; E-learning; Visual Arts and Performing Arts"
680;21100236810;"2012 4th International Conference "Problems of Cybernetics and Informatics", PCI 2012 - Proceedings";conference and proceedings;"-";0,103;-;5;0;232;0;8;231;0,03;0,00;United States;Northern America;"";"2012";"Artificial Intelligence; Information Systems"
681;21100236210;"4th International Conference on Intelligent Human Computer Interaction: Advancing Technology for Humanity, IHCI 2012";conference and proceedings;"-";0,103;-;11;0;97;0;19;95;0,20;0,00;United States;Northern America;"";"2012";"Artificial Intelligence; Human-Computer Interaction"
682;21100431313;"Advanced Information and Knowledge Processing";book series;"21978441, 16103947";0,103;Q4;14;62;204;2639;38;7;0,21;42,56;United States;Northern America;"Springer Science + Business Media";"2006-2017, 2019-2020";"Artificial Intelligence (Q4); Information Systems (Q4); Information Systems and Management (Q4); Management Information Systems (Q4)"
683;21100285071;"AISB/IACAP World Congress 2012: Moral Cognition and Theory of Mind, Part of Alan Turing Year 2012";conference and proceedings;"-";0,103;-;2;0;13;0;1;10;0,08;0,00;United Kingdom;Western Europe;"";"2012";"Artificial Intelligence"
684;21100285077;"AISB/IACAP World Congress 2012: Natural Computing/Unconventional Computing and Its Philosophical Significance, Part of Alan Turing Year 2012";conference and proceedings;"-";0,103;-;1;0;21;0;3;20;0,14;0,00;United Kingdom;Western Europe;"";"2012";"Artificial Intelligence"
685;21100285080;"AISB/IACAP World Congress 2012: Revisiting Turing and His Test: Comprehensiveness, Qualia, and the Real World, Part of Alan Turing Year 2012";conference and proceedings;"-";0,103;-;3;0;13;0;3;10;0,23;0,00;United Kingdom;Western Europe;"";"2012";"Artificial Intelligence"
686;21100285073;"AISB/IACAP World Congress 2012: Turing Arts Symposium, Part of Alan Turing Year 2012";conference and proceedings;"-";0,103;-;1;0;10;0;0;7;0,00;0,00;United Kingdom;Western Europe;"";"2012";"Artificial Intelligence"
687;6700153285;"International Journal of Mobile Network Design and Innovation";journal;"17442869, 17442850";0,103;Q4;11;12;36;327;5;36;0,17;27,25;United Kingdom;Western Europe;"Inderscience Enterprises Ltd";"2006-2007, 2009-2013, 2019";"Artificial Intelligence (Q4); Computer Networks and Communications (Q4); Management Information Systems (Q4); Software (Q4)"
688;21100223751;"Proceedings - 2012 IEEE 8th International Conference on Intelligent Computer Communication and Processing, ICCP 2012";conference and proceedings;"-";0,103;-;6;0;61;0;16;59;0,26;0,00;United States;Northern America;"";"2012";"Artificial Intelligence; Computer Networks and Communications"
689;21100206243;"Proceedings - 2012 IEEE Symposium on Robotics and Applications, ISRA 2012";conference and proceedings;"-";0,103;-;6;0;253;0;20;252;0,08;0,00;United States;Northern America;"";"2012";"Artificial Intelligence; Hardware and Architecture"
690;21100223716;"Proceedings of the 22nd Midwest Artificial Intelligence and Cognitive Science Conference, MAICS 2011";conference and proceedings;"-";0,103;-;6;0;36;0;9;34;0,25;0,00;United States;Northern America;"";"2011";"Artificial Intelligence"
691;21100204932;"Proceedings of the International Symposium on Matching and Meaning Automated Development, Evolution and Interpretation of Ontologies - A Symposium at the AISB 2010 Convention";conference and proceedings;"-";0,103;-;2;0;12;0;2;10;0,00;0,00;United Kingdom;Western Europe;"";"2010";"Artificial Intelligence"
692;20500195107;"VECIMS 2011 - 2011 IEEE International Conference on Virtual Environments, Human-Computer Interfaces and Measurement Systems, Proceedings";conference and proceedings;"-";0,103;-;5;0;29;0;7;27;0,24;0,00;United States;Northern America;"";"2011";"Artificial Intelligence; Human-Computer Interaction; Software"
693;21100241798;"12th International Conference on Intelligent Games and Simulation, GAME-ON 2011";conference and proceedings;"-";0,102;-;2;0;14;0;1;12;0,07;0,00;Belgium;Western Europe;"";"2011";"Artificial Intelligence; Computer Graphics and Computer-Aided Design; Human-Computer Interaction; Software"
694;19700194113;"12th WSEAS International Conference on Mathematical Methods, Computational Techniques and Intelligent Systems, MAMECTIS '10";conference and proceedings;"-";0,102;-;3;0;45;0;5;43;0,00;0,00;United States;Northern America;"";"2010";"Artificial Intelligence; Computational Theory and Mathematics; Theoretical Computer Science"
695;19700183187;"2010 International Conference on Logistics Engineering and Intelligent Transportation Systems, LEITS2010 - Proceedings";conference and proceedings;"-";0,102;-;4;0;108;0;7;106;0,00;0,00;United States;Northern America;"";"2010";"Artificial Intelligence; Computer Networks and Communications; Transportation"
696;21100371953;"3rd Asian Conference on Intelligent Games and Simulation, GAME-ON ASIA 2011 - 3rd Asian Simulation Technology Conference, ASTEC 2011";conference and proceedings;"-";0,102;-;3;0;12;0;1;10;0,08;0,00;Belgium;Western Europe;"";"2011";"Artificial Intelligence; Human-Computer Interaction; Modeling and Simulation"
697;21100304864;"6th International North-American Conference on Intelligent Games and Simulation 2011, Game-On 'NA 2009, 3rd International North American Simulation Technology Conference, NASTEC 2011";conference and proceedings;"-";0,102;-;2;0;11;0;2;9;0,18;0,00;Belgium;Western Europe;"";"2011";"Artificial Intelligence; Human-Computer Interaction; Modeling and Simulation"
698;21100205942;"AISB 2011: AI and Games";conference and proceedings;"-";0,102;-;3;0;13;0;1;10;0,08;0,00;United Kingdom;Western Europe;"";"2011";"Artificial Intelligence; Computer Graphics and Computer-Aided Design; Software"
699;21100285060;"AISB/IACAP World Congress 2012: Social Computing, Social Cognition, Social Networks and Multiagent Systems, Social Turn - SNAMAS 2012, Part of Alan Turing Year 2012";conference and proceedings;"-";0,102;-;3;0;22;0;3;19;0,14;0,00;United Kingdom;Western Europe;"";"2012";"Artificial Intelligence"
700;21100285059;"AISB/IACAP World Congress 2012: Symposium on the History and Philosophy of Programming, Part of Alan Turing Year 2012";conference and proceedings;"-";0,102;-;2;0;13;0;0;10;0,00;0,00;United Kingdom;Western Europe;"";"2012";"Artificial Intelligence"
701;19900193222;"IEEE SSCI 2011 - Symposium Series on Computational Intelligence - CompSens 2011: 2011 IEEE Workshop on Merging Fields of Computational Intelligence and Sensor Technology";conference and proceedings;"-";0,102;-;3;0;12;0;2;11;0,17;0,00;United States;Northern America;"";"2011";"Artificial Intelligence; Computational Theory and Mathematics; Electrical and Electronic Engineering"
702;21100346453;"Intelligent Technologies in Logistics and Mechatronics Systems, ITELMS 2012 - Proceedings of the 7th International Conference";conference and proceedings;"-";0,102;-;2;0;36;0;3;34;0,08;0,00;Latvia ;Eastern Europe;"";"2012";"Artificial Intelligence; Control and Systems Engineering; Mechanical Engineering"
703;21100523008;"International Conference on Computational Intelligence, Man-Machine Systems and Cybernetics - Proceedings";conference and proceedings;"-";0,102;-;5;0;45;0;5;43;0,00;0,00;Venezuela;Latin America;"";"2010";"Electrical and Electronic Engineering; Materials Science (miscellaneous); Mechanics of Materials"
704;21100215915;"PACIFIC 2011 - International Conference on: Pantograph-Catenary Interaction Framework for Intelligent Control, Conference Proceedings";conference and proceedings;"-";0,102;-;4;0;16;0;3;14;0,19;0,00;France;Western Europe;"";"2011";"Artificial Intelligence; Control and Systems Engineering"
705;21100247029;"Proceedings - 2012 9th Electronics, Robotics and Automotive Mechanics Conference, CERMA 2012";conference and proceedings;"-";0,102;-;5;0;74;0;4;72;0,05;0,00;United States;Northern America;"";"2012";"Artificial Intelligence; Automotive Engineering"
706;19900193725;"Proceedings of the 16th IASTED International Conference on Robotics and Applications, RA 2011";conference and proceedings;"-";0,102;-;2;0;21;0;2;19;0,10;0,00;United States;Northern America;"";"2011";"Artificial Intelligence; Computer Science Applications"
707;19900193831;"Proceedings of the International Conference on Advances in Computing and Artificial Intelligence, ACAI 2011";conference and proceedings;"-";0,102;-;5;0;51;0;6;49;0,12;0,00;United States;Northern America;"";"2011";"Artificial Intelligence; Computational Theory and Mathematics"
708;21100248947;"2012 5th Robotics and Mechatronics Conference of South Africa, ROBMECH 2012";conference and proceedings;"-";0,101;-;3;0;21;0;3;20;0,14;0,00;United States;Northern America;"";"2012";"Artificial Intelligence; Electrical and Electronic Engineering; Mechanical Engineering"
709;21100338324;"21es Journees Francophones d'Ingenierie des Connaissances, IC 2010";conference and proceedings;"-";0,101;-;1;0;25;0;3;23;0,00;0,00;France;Western Europe;"";"2010";"Artificial Intelligence; Software"
710;21100232426;"22emes Journees Francophones d'Ingenierie des Connaissances, IC 2011";conference and proceedings;"-";0,101;-;2;0;24;0;0;22;0,00;0,00;France;Western Europe;"";"2011";"Artificial Intelligence; Computational Theory and Mathematics"
711;21100196901;"3rd Int. Joint Topical Meeting on Emergency Preparedness and Response and Robotics and Remote Systems 2011, EPRRSD, and 13th Robotics and Remote Systems for Hazardous Environments";conference and proceedings;"-";0,101;-;4;0;95;0;4;93;0,04;0,00;United States;Northern America;"";"2011";"Artificial Intelligence; Environmental Engineering"
712;21100237621;"5th ACM COMPUTE Conference: Intelligent and Scalable System Technologies, COMPUTE 2012";conference and proceedings;"-";0,101;-;4;0;22;0;2;20;0,09;0,00;United States;Northern America;"";"2012";"Artificial Intelligence; Software"
713;21100285709;"AISB/IACAP World Congress 2012 - The Machine Question: AI, Ethics and Moral Responsibility, Part of Alan Turing Year 2012";conference and proceedings;"-";0,101;-;2;0;20;0;1;17;0,05;0,00;United Kingdom;Western Europe;"";"";"Artificial Intelligence"
714;21100241653;"AUVSI Unmanned Systems North America Conference 2012";conference and proceedings;"-";0,101;-;4;0;409;0;13;401;0,03;0,00;United States;Northern America;"";"2010, 2012";"Aerospace Engineering; Automotive Engineering; Control and Systems Engineering"
715;21100267911;"CIbSE 2010 - Actas - 13th Conferencia Iberoamericana en "Software Engineering"";conference and proceedings;"-";0,101;-;3;0;38;0;6;37;0,00;0,00;United States;Northern America;"";"2010";"Artificial Intelligence; Human-Computer Interaction; Signal Processing; Software"
716;19900191707;"eChallenges e-2010 Conference";conference and proceedings;"-";0,101;-;5;0;107;0;9;106;0,00;0,00;United States;Northern America;"";"2010";"Artificial Intelligence; Computational Theory and Mathematics; Computer Science Applications"
717;21100255060;"IADIS International Conference on Cognition and Exploratory Learning in Digital Age, CELDA 2011";conference and proceedings;"-";0,101;-;3;0;54;0;6;52;0,11;0,00;Portugal;Western Europe;"";"2011";"Artificial Intelligence; Education"
718;21100255075;"IADIS International Conference on Cognition and Exploratory Learning in Digital Age, CELDA 2012";conference and proceedings;"-";0,101;-;5;0;50;0;2;48;0,04;0,00;Portugal;Western Europe;"";"2012";"Artificial Intelligence; Education; E-learning"
719;21100236012;"IC 2012 - 23es Journees Francophones d'Ingenierie des Connaissances";conference and proceedings;"-";0,101;-;3;0;32;0;3;31;0,09;0,00;France;Western Europe;"";"2012";"Artificial Intelligence; Computational Theory and Mathematics"
720;21100241683;"International Conference on Automation, Robotics and Control Systems 2010, ARCS 2010";conference and proceedings;"-";0,101;-;2;0;25;0;2;23;0,00;0,00;United States;Northern America;"";"2010";"Artificial Intelligence; Control and Systems Engineering"
721;21100286850;"International Conference on Next Generation Networks and Services, NGNS";conference and proceedings;"23276525, 23276533";0,101;-;7;0;30;0;2;28;0,07;0,00;United States;Northern America;"";"2012, 2014";"Artificial Intelligence; Computer Networks and Communications; Hardware and Architecture"
722;19900192128;"ISA Automation Week 2010: Technology and Solutions Event";conference and proceedings;"-";0,101;-;1;0;31;0;0;30;0,00;0,00;United States;Northern America;"";"2010";"Artificial Intelligence; Control and Systems Engineering"
723;21100775348;"ISCIIA 2012 - 5th International Symposium on Computational Intelligence and Industrial Applications";conference and proceedings;"-";0,101;-;2;0;38;0;2;35;0,05;0,00;Japan;Asiatic Region;"";"2012";"Ocean Engineering; Oceanography; Water Science and Technology"
724;5800207596;"Linguistica";journal;"2079312X, 11320214";0,101;Q4;4;21;22;565;0;21;0,00;26,90;Uruguay;Latin America;"Asociacin de Lingistica y Filologa de la Amrica Latina";"2012-2019";"Artificial Intelligence (Q4); Language and Linguistics (Q4); Linguistics and Language (Q4)"
725;21100498294;"LISS 2011 - Proceedings of the 1st International Conference on Logistics, Informatics and Service Science";conference and proceedings;"-";0,101;-;1;0;27;0;1;26;0,04;0,00;Portugal;Western Europe;"";"";"Artificial Intelligence; Computational Theory and Mathematics; Information Systems; Software"
726;21100229804;"Proceedings - 2012 3rd Global Congress on Intelligent Systems, GCIS 2012";conference and proceedings;"-";0,101;-;6;0;101;0;9;99;0,09;0,00;United States;Northern America;"";"2012";"Artificial Intelligence; Information Systems"
727;21100217215;"Proceedings of International Conference on Information and Computing Science, ICIC";conference and proceedings;"21607451, 21607443";0,101;-;5;0;61;0;7;59;0,11;0,00;United States;Northern America;"";"2012";"Artificial Intelligence; Computer Science Applications; Information Systems; Software"
728;21100227010;"Proceedings of Special Session - Revised Papers, 11th Mexican International Conference on Artificial Intelligence 2012: Advances in Artificial Intelligence and Applications, MICAI 2012";conference and proceedings;"-";0,101;-;6;0;24;0;1;22;0,04;0,00;United States;Northern America;"";"2012";"Artificial Intelligence; Computer Science Applications"
729;21100203524;"Proceedings of the 13th IASTED International Conference on Computers and Advanced Technology in Education, CATE 2010";conference and proceedings;"-";0,101;-;3;0;35;0;5;34;0,00;0,00;Canada;Northern America;"";"2010";"Artificial Intelligence; Education"
730;21100225822;"Proceedings of the 21st Midwest Artificial Intelligence and Cognitive Science Conference, MAICS 2010";conference and proceedings;"-";0,101;-;2;0;18;0;0;16;0,00;0,00;United States;Northern America;"";"2010";"Artificial Intelligence"
731;21100244203;"Proceedings of the 5th International Conference on Communications, Computers and Applications, MIC-CCA 2012";conference and proceedings;"-";0,101;-;5;0;33;0;1;32;0,03;0,00;United States;Northern America;"";"2012";"Artificial Intelligence; Computer Science Applications"
732;21100255718;"Proceedings of the IASTED International Conference on Artificial Intelligence and Soft Computing, ASC 2011";conference and proceedings;"-";0,101;-;3;0;19;0;2;18;0,11;0,00;Canada;Northern America;"";"2011";"Artificial Intelligence; Software"
733;19800188024;"Proceedings of the IASTED International Conference on Robotics, Robo 2010";conference and proceedings;"-";0,101;-;3;0;31;0;1;30;0,00;0,00;United States;Northern America;"";"2010";"Artificial Intelligence; Computer Vision and Pattern Recognition; Human-Computer Interaction"
734;21100204928;"Proceedings of the International Symposium on AI Inspired Biology - A Symposium at the AISB 2010 Convention";conference and proceedings;"-";0,101;-;4;0;23;0;3;21;0,00;0,00;United Kingdom;Western Europe;"";"2010";"Artificial Intelligence; Molecular Biology"
735;21100301607;"RASLAN 2010 - Recent Advances in Slavonic Natural Language Processing: 4th Workshop on Recent Advances in Slavonic Natural Language Processing, Proceedings";conference and proceedings;"-";0,101;-;2;0;17;0;0;15;0,00;0,00;Czech Republic;Eastern Europe;"";"2010";"Artificial Intelligence; Computational Theory and Mathematics; Information Systems; Software"
736;21100301608;"RASLAN 2011 - Recent Advances in Slavonic Natural Language Processing: 5th Workshop on Recent Advances in Slavonic Natural Language Processing, Proceedings";conference and proceedings;"-";0,101;-;2;0;17;0;2;15;0,12;0,00;Czech Republic;Eastern Europe;"";"2011";"Artificial Intelligence; Computational Theory and Mathematics; Information Systems; Software"
737;21100227426;"Society for Information Display - Vehicle Displays and Interfaces Symposium 2011, Papers and Presentations";conference and proceedings;"-";0,101;-;3;0;26;0;0;25;0,00;0,00;United States;Northern America;"";"2011";"Artificial Intelligence; Automotive Engineering"
738;21100456782;"Sustainable Packaging Symposium 2011";conference and proceedings;"-";0,101;-;0;0;21;0;0;20;0,00;0,00;United States;Northern America;"";"2011";"Artificial Intelligence; Automotive Engineering"
739;21100797716;"15th IUAPPA World Clean Air Congress 2010, Presentations";conference and proceedings;"-";0,100;-;1;0;128;0;0;125;0,00;0,00;United States;Northern America;"";"2010";"Artificial Intelligence; Human-Computer Interaction; Modeling and Simulation"
740;21100797885;"15th IUAPPA World Clean Air Congress 2010, Presentations";conference and proceedings;"-";0,100;-;0;0;37;0;0;36;0,00;0,00;United States;Northern America;"";"";"Artificial Intelligence; Software"
741;21100334815;"CISCI 2010 - Novena Conferencia Iberoamericana en Sistemas, Cibernetica e Informatica, 7to Simposium Iberoamericano en Educacion, Cibernetica e Informatica, SIECI 2010 - Memorias";conference and proceedings;"-";0,100;-;1;0;143;0;2;140;0,00;0,00;United States;Northern America;"";"2010";"Artificial Intelligence; Computer Science Applications; Information Systems"
742;21100334840;"CISCI 2012 - Undecima Conferencia Iberoamericana en Sistemas, Cibernetica e Informatica, Noveno Simposium Iberoamericano en Educacion, Cibernetica e Informatica, SIECI 2012 - Memorias";conference and proceedings;"-";0,100;-;1;0;77;0;0;75;0,00;0,00;United States;Northern America;"";"2012";"Artificial Intelligence; Computer Science Applications; Information Systems"
743;21100297614;"IMSCI 2011 - 5th International Multi-Conference on Society, Cybernetics and Informatics, Proceedings";conference and proceedings;"-";0,100;-;4;0;249;0;11;243;0,04;0,00;United States;Northern America;"";"2008, 2009, 2010, 2011";"Artificial Intelligence; Information Systems"
744;21100298057;"IMSCI 2012 - 6th International Multi-Conference on Society, Cybernetics and Informatics, Proceedings";conference and proceedings;"-";0,100;-;2;0;48;0;1;46;0,02;0,00;United States;Northern America;"";"2012";"Artificial Intelligence; E-learning; Information Systems"
745;21100238650;"International Conference on Artificial Intelligence and Pattern Recognition 2010, AIPR 2010";conference and proceedings;"-";0,100;-;2;0;49;0;2;47;0,00;0,00;United States;Northern America;"";"2010";"Artificial Intelligence; Computer Vision and Pattern Recognition"
746;21100229403;"IWACIII 2011 - International Workshop on Advanced Computational Intelligence and Intelligent Informatics, Proceedings";conference and proceedings;"-";0,100;-;3;0;53;0;5;49;0,09;0,00;Japan;Asiatic Region;"";"2011";"Artificial Intelligence; Information Systems"
747;21100225812;"Proceedings - 5th International Conference on Intelligent Networks and Intelligent Systems, ICINIS 2012";conference and proceedings;"-";0,100;-;6;0;92;0;11;90;0,12;0,00;United States;Northern America;"";"2012";"Artificial Intelligence; Computer Networks and Communications"
748;21100329898;"11th International Workshop for Technical, Economic and Legal Aspects of Business Models for Virtual Goods, VIRTUAL GOODS + ODRL 2013, Incorporating the 9th W3C ODRL Community Group Meeting";conference and proceedings;"-";;-;0;6;0;10;0;0;0,00;1,67;Germany;Western Europe;"";"2013";"Artificial Intelligence; Information Systems and Management"
749;21100307424;"12th International Conference on Autonomous Agents and Multiagent Systems 2013, AAMAS 2013";conference and proceedings;"-";;-;32;320;0;3961;0;0;0,00;12,38;United States;Northern America;"";"2013, 2014";"Artificial Intelligence"
750;21100296617;"14th International Conference on Intelligent Games and Simulation, GAME-ON 2013";conference and proceedings;"-";;-;2;15;0;218;0;0;0,00;14,53;Belgium;Western Europe;"";"2013";"Artificial Intelligence; Computer Graphics and Computer-Aided Design; Human-Computer Interaction; Software"
751;21100496280;"19th Americas Conference on Information Systems, AMCIS 2013 - Hyperconnected World: Anything, Anywhere, Anytime";conference and proceedings;"-";;-;9;176;0;5561;0;0;0,00;31,60;United States;Northern America;"";"2013";"Artificial Intelligence; Information Systems"
752;21100239641;"2013 10th International Conference on Remote Engineering and Virtual Instrumentation, REV 2013";conference and proceedings;"-";;-;4;30;0;429;0;0;0,00;14,30;United States;Northern America;"";"2013";"Artificial Intelligence; E-learning; Instrumentation"
753;21100305344;"2013 10th International Conference on Ubiquitous Robots and Ambient Intelligence, URAI 2013";conference and proceedings;"-";;-;8;216;0;1625;0;0;0,00;7,52;United States;Northern America;"";"2013";"Artificial Intelligence; Human-Computer Interaction"
754;21100276768;"2013 13th UK Workshop on Computational Intelligence, UKCI 2013";conference and proceedings;"-";;-;8;49;0;1186;0;0;0,00;24,20;United States;Northern America;"";"2013";"Artificial Intelligence; Computational Theory and Mathematics"
755;21100307425;"2013 16th International Conference on Advanced Robotics, ICAR 2013";conference and proceedings;"-";;-;11;149;0;2742;0;0;0,00;18,40;United States;Northern America;"";"2013";"Artificial Intelligence; Human-Computer Interaction; Software"
756;21100286323;"2013 17th International Conference on Intelligence in Next Generation Networks, ICIN 2013";conference and proceedings;"-";;-;4;22;0;408;0;0;0,00;18,55;United States;Northern America;"";"2013";"Artificial Intelligence; Computer Networks and Communications"
757;21100286321;"2013 18th International Conference on Methods and Models in Automation and Robotics, MMAR 2013";conference and proceedings;"-";;-;9;63;0;1154;0;0;0,00;18,32;United States;Northern America;"";"2013";"Artificial Intelligence; Control and Systems Engineering"
758;21100307472;"2013 1st Workshop on Virtual and Augmented Assistive Technology, VAAT 2013; Co-located with the 2013 Virtual Reality Conference - Proceedings";conference and proceedings;"-";;-;3;7;0;128;0;0;0,00;18,29;United States;Northern America;"";"2013";"Artificial Intelligence; E-learning"
759;21100259552;"2013 21st Mediterranean Conference on Control and Automation, MED 2013 - Conference Proceedings";conference and proceedings;"-";;-;15;252;0;4614;0;0;0,00;18,31;United States;Northern America;"";"2013";"Artificial Intelligence; Control and Systems Engineering"
760;21100286427;"2013 2nd International Congress of Engineering Mechatronics and Automation, CIIMA 2013 - Conference Proceedings";conference and proceedings;"-";;-;3;24;0;363;0;0;0,00;15,13;United States;Northern America;"";"2013";"Artificial Intelligence; Mechanical Engineering"
761;21100264885;"2013 2nd International Workshop on Realizing Artificial Intelligence Synergies in Software Engineering, RAISE 2013 - Proceedings";conference and proceedings;"-";;-;5;11;0;322;0;0;0,00;29,27;United States;Northern America;"";"2013";"Artificial Intelligence; Software"
762;21100258917;"2013 3rd Joint Conference of AI and Robotics and 5th RoboCup Iran Open International Symposium: Learning, Glorious Future, RIOS 2013";conference and proceedings;"-";;-;5;26;0;436;0;0;0,00;16,77;United States;Northern America;"";"2013";"Artificial Intelligence; Human-Computer Interaction; Software"
763;21100285451;"2013 44th International Symposium on Robotics, ISR 2013";conference and proceedings;"-";;-;10;151;0;1648;0;0;0,00;10,91;United States;Northern America;"";"2013";"Artificial Intelligence; Human-Computer Interaction"
764;21100269639;"2013 5th International Conference on Computational Aspects of Social Networks, CASoN 2013";conference and proceedings;"-";;-;5;15;0;252;0;0;0,00;16,80;United States;Northern America;"";"2013";"Artificial Intelligence; Computer Networks and Communications"
765;21100297821;"2013 6th International Conference on Advanced Computational Intelligence, ICACI 2013 - Proceedings";conference and proceedings;"-";;-;9;72;0;1116;0;0;0,00;15,50;United States;Northern America;"";"2013";"Artificial Intelligence; Computational Theory and Mathematics"
766;21100255311;"2013 8th International Conference on Intelligent Systems: Theories and Applications, SITA 2013";conference and proceedings;"-";;-;6;42;0;723;0;0;0,00;17,21;United States;Northern America;"";"2013";"Artificial Intelligence; Information Systems"
767;21100302211;"2013 e-Manufacturing and Design Collaboration Symposium, eMDC 2013";conference and proceedings;"-";;-;2;34;0;167;0;0;0,00;4,91;United States;Northern America;"";"2013";"Artificial Intelligence; Industrial and Manufacturing Engineering"
